排名,标题,播放量,讨论数,得分,封面链接,UP的ID,视频av号
1,不要笑挑战❌新故事王✔,147.0万,1.8万,2009778,562197,BV1ek4y1q7WM
2,"""杜海皇""之死",120.8万,1.2万,979427,5970160,BV1bC4y1877x
3,从印度下架59款中国软件到德里酒店抵制中国客人 越来越离谱的印度封国第九十七天,86.4万,5261,861543,300159010,BV1kK411n7iX
4,重庆最辣小面？的车司机：这就辣得离谱！我。。。。,55.8万,7099,621084,99157282,BV1754y1z7Rb
5,碳水炸弹狂欢！第一次吃100元两碗的面，我的嘴角竟流下了瀑布…,46.1万,1.0万,594044,29329085,BV1PC4y1h7jr
6,禁食390天，感谢你们一路的支持，我结核终于治愈了,45.7万,3838,541949,470810968,BV1Ug4y1v7nN
7,名场面预订了、笑死我了,61.3万,419,520137,558275338,BV1Bt4y197hZ
8,朋友之间传播淫秽信息一般不按犯罪处理,44.2万,1.5万,506236,67141499,BV1kv411B7VM
9,看完整个人都扭曲了……,40.6万,2325,479915,421848021,BV1JV411679S
10,这么完美的男人确实很难遇到,41.2万,551,465733,344677344,BV1HC4y1a7BN
11,就喜欢这种长得好看还没脑子的,47.2万,579,465264,43979779,BV1Bz4y1X7FC
12,试吃999元一桶的冰激凌，三种新奇吃法哪种最好吃？,52.7万,5440,464264,2920960,BV1PZ4y1u7YE
13,又是一个无 眠 夜。,27.6万,717,464025,27756469,BV1YC4y187Hb
14,美国枪支销量暴增80%，深入枪店采访美国人为何囤枪？,46.5万,3096,463689,176037767,BV1vi4y1G7Lu
15,厨师长的厨具和配件终于全部到齐了，先简简单单整理一下,50.4万,3585,442493,290526283,BV155411Y7gU
16,真正的底层，深圳三和人力市场，挂逼面3元一碗,48.8万,1566,433131,35847683,BV1R54y1i7Gp
17,武松打得过这玩意儿？,32.0万,946,415765,496783876,BV1mT4y1J7iG
18,“抠门”父亲只让女儿吃稀饭馒头,24.6万,396,405617,439004951,BV1ZK411n7vM
19,串串配烧烤，大sao第一次尝试本地宵夜大排档，一个人的量真过瘾,45.5万,1788,405605,390461123,BV1DT4y1J7vA
20,我竟然当了表演老师？！,37.7万,4698,402404,808171,BV1A5411Y747
21,为什么狮子和老虎会害怕我的拖鞋,32.6万,985,391066,590490400,BV1ig4y1v7RH
22,【醒醒】中华儿女该起床了,12.5万,1698,390008,2331173,BV1m54y1Q7eQ
23,买一台98寸超巨大电视来玩游戏是什么体验？！震撼我实习生！！,35.7万,2630,388867,52250,BV12p4y1U76o
24,好不容易在一个城市买了一套房，可是空调费是25元每度，真都没人管管吗？,45.3万,628,382931,494098566,BV1La4y1e7va
25,有一种默契，叫做大家都是成年人~,28.3万,511,375085,124574179,BV1xV41167wG
26,梦     幻      联      动,30.3万,146,359449,294059122,BV1ea4y1Y7CM
27,在法语里H基本是不发音的，那他们都是怎么笑的？他们知道中国有个城市叫呼和浩特吗？,29.1万,452,350688,8662074,BV1XZ4y1M7kf
28,骗女朋友拍2万块的婚纱照！女朋友说终于美了一回！,19.5万,1791,342582,285571498,BV1Ui4y1G7RA
29,口技大师！,26.3万,3166,335801,546195,BV1Df4y1174h
30,隐秘的角落隐藏结局，看完我人傻了,30.4万,361,327007,883968,BV1UZ4y1H7Vz
31,“我以为，我抓住了……”,34.0万,456,321747,490345780,BV14A411i76o
32,无广！花3天测评20多种懒人速食食品！开水一冲就是一顿饭！到底哪款好吃又合适！,20.2万,1280,297272,107486042,BV1EA411e7dj
33,在家也能做出和酒楼里的一样好吃的炒面，面虽好吃，可别心急去吃,18.3万,713,297088,415479453,BV1Zi4y1G7po
34,情 侣 旅 游 现 状 (2),21.8万,8537,290015,113362335,BV1AZ4y1p77L
35,只要你够自信，你就是明星,26.6万,65,285073,574431471,BV1Sf4y1278s
36,我手一伸过去就翻肚皮是啥意思？！嫌弃我？,27.7万,130,270964,7074507,BV1Fk4y167Y6
37,什么生理要求呀？？?,27.4万,208,261140,82024048,BV1sk4y1q7u6
38,【大胃王】很多鲑鱼卵的豪华明太子奶油意大利面! 浓厚和微辣口味的完美搭配！[冷玉米汤] (3.1公斤)(9000卡路里) 【木下佑香】,25.6万,421,259480,592449193,BV1cK411H7fC
39,突如其来的....拐卖？？,28.0万,9,258398,485677019,BV1Av411z7Bi
40,车祸现场，一不小心就从配角变主角了！,27.6万,26,257912,85317606,BV19K411n741
41,“五秒就够了！”,23.4万,1315,256706,5374954,BV16K411n7UH
42,斥巨资1200块试吃小乳猪！口感酥脆就是有点贵！,24.0万,2400,255779,414641554,BV1Sk4y1q7K3
43,如果播音小姐姐被处罚了 全赖你们！,16.9万,92,252784,33971748,BV1dJ411J7WP
44,我的前女友回来…砸场了！【绅士一分钟】,17.7万,3176,252486,1643718,BV1mz411e7AR
45,做鸭警告！！！一碗下去全身湿透也值了,15.5万,998,252172,270105105,BV1wZ4y1p7uU
46,陈师行道长早期练功资料，武当功夫一样注重实战训练,23.5万,239,244252,514019783,BV14T4y177L4
47,别骂了别骂了 真的不是美颜卡了,25.0万,191,235583,545348008,BV1Gi4y1V7Be
48,伸手不打笑脸人,22.9万,25,233224,31947530,BV1Up4y1U7C8
49,油管播放量破亿却惨被删除封号的特朗普恶搞视频,16.9万,325,232755,12394995,BV1Ea4y1Y7Bi
50,感受一下直男猫咪对你笨拙的爱…,17.7万,978,232316,2678945,BV1Vi4y1V7Rt
51,兑现我的承诺,18.8万,75,232080,601325957,BV1KC4y1h7Ea
52,爱一个人，就陪她走一遍儿时的路,12.7万,2324,231161,353539995,BV1454y1z7NE
53,建议保送清华,19.0万,243,230587,6644646,BV1Ft4y1972e
54,男人的快乐可以有多简单1,17.2万,87,225516,381983587,BV1i54y1D7sw
55,扪心自问，你真的讨厌广场舞吗,22.9万,215,223116,586350824,BV1LV41167dq
56,爱心哥脸部历经16次手术，98年投身慈善助学，帮扶5000多名特困生,19.0万,522,219354,364155494,BV1Zz411e7Fg
57,“这是我爸”“爸！”,19.4万,526,215978,330383888,BV1KK411H7SV
58,为了找只好鸡，我都经历了什么？,16.0万,5923,213091,25150941,BV1p54y1z7Xm
59,经验分享｜这么漂亮的女朋友我是怎么追到的？,17.6万,768,213023,514777186,BV1mi4y1G7qX
60,当初美国队长要会这招，单挑灭霸不在话下,21.6万,81,212676,473637654,BV1dZ4y1M7CU
61,【日啖螃蟹三十斤，不辞长作痛风人 】 S2019-HA231,14.2万,2276,208961,10664325,BV1WK4y1s7N1
62,豪华蜜桃甜品宴，王母娘娘看了也眼馋！,13.2万,672,208562,8960728,BV1pD4y1Q7N3
63,今晚就一桌 | 5个月赔了200万，90后湖北女生的北京魔幻创业史,17.0万,2360,207715,39627524,BV1PZ4y1u793
64,阿珍看到这个视频，来找我，我等你,20.6万,168,207254,472721474,BV1Nz4y1X7pF
65,知名女拳师竟要求取消男性上学资格 禁止男性识字？太离谱了！沙雕网友迷惑操作行为大赏！,18.5万,2133,206297,386579215,BV1UC4y187rr
66,滴滴代练，你不能坚持健身，是因为没有找到我！,20.2万,62,205676,549772707,BV11A411i7By
67,【朱一旦】203 螳螂扑蝉 黄雀在后,20.5万,487,203944,437316738,BV1x5411Y75f
68,你管这叫 cosplay？？？,16.9万,4921,203367,147166910,BV1a5411Y7xt
69,以为找了个男朋友，结果找了个兄弟,20.1万,11,202618,299291982,BV1cv411z7z5
70,和兄弟在一起，让女朋友吃醋瞬间！,19.0万,123,201428,523111395,BV1Kz4y1R7rT
71,【Hamzy的今日份吃播】：糖醋肉&起司&泡菜～最新火热组合～★冰啤酒～！,18.9万,660,200841,481470422,BV1xt4y197j9
72,火锅大王消失的这段时间发生了什么？,11.9万,330,200308,394067394,BV16f4y117U4
73,去会所到底是你高兴还是技师高兴？,20.5万,18,197187,423877880,BV1sa4y1Y7jq
74,5斤鸡腿做韩式炸鸡腿，帅小伙做了满满两大盘吃着太过瘾了！,17.7万,1219,196976,337521240,BV1sA411i7d9
75,软萌少女也能空手劈西瓜。,18.4万,658,196757,397076059,BV1mK411n7XN
76,有名的齐齐哈尔烤肉，3个人吃到吐也不到300块,17.7万,1357,195285,382986457,BV1bA411i7Hk
77,人类早期驯服野生无人机的珍贵影像,16.9万,285,192661,474267806,BV1gz4y1X7ug
78,当你拿泡泡机对着猫...,16.8万,76,191001,25271172,BV1a5411Y7f5
79,男子见女友腹部上有刀疤，怀疑她生过孩子，选择5.20当天分手。,19.9万,24,190568,22131865,BV1VA411e7Gx
80,挑战3大斤35天熟成霓虹和牛+猛吃30人份冰淇淋，RAY竟然吃不胖？！！！,15.9万,1829,188410,338927049,BV1rt4y197BM
81,原来男人的快乐这么简单？！,17.8万,38,186513,137910465,BV1yA411i7zX
82,当你亲女朋友的时候……（画面过于真实）,18.3万,91,185953,11768386,BV1rz4y1X7qf
83,这手法值多少钱？,19.4万,13,185276,482599341,BV1mp4y1U7oQ
84,挑战24小时只吃冰淇凌，我竟然吃了10斤！,12.8万,1107,177956,21587273,BV1wD4y1S7wz
85,百 万 广 告 重 做 !!!,13.5万,173,177863,576534137,BV1PD4y1S72Q
86,？？？？？,10.5万,70,177701,7560829,BV1z54y1B7af
87,【王布斯】假如哪天朱一旦破产了，谁陪我去吃烧烤呢？！,17.6万,176,175046,449545834,BV1554y1z7hx
88,雕刻青年时期的红发香克斯,13.3万,342,171230,591856754,BV1qT4y177c8
89,低脂饱腹！一口可以吃上好多种蔬菜的鸡胸肉饼！晚饭还做了蟹黄豆腐煲,7.4万,230,168379,472129071,BV1Z54y1i7pE
90,【Pamela Reif】魔鬼帕梅拉10分钟初学者腹部训练，新手姐妹也能跟得上啦！,5.8万,407,167585,34044873,BV1o7411E71J
91,高 考 生 现 状 ？,10.0万,1481,167363,14520741,BV1da4y1Y7mD
92,2030买一条全市场最大的珍珠龙胆石斑鱼，30几斤重，一个人按不住,12.3万,475,166440,476704454,BV1XT4y1J7xx
93,“你没穷过，你不懂”,9.9万,333,165987,519392580,BV1GV411k7Zd
94,当杠精去面试会怎么样，面试官都被气笑了……,11.7万,65,165233,494915055,BV1y54y1B797
95,科二块考试了，用儿子的车多练练,17.1万,15,165116,18020554,BV1Kz4y1R71V
96,摆地摊，日常撩妹，却碰上硬核女孩了,15.4万,123,164041,535505483,BV1Mz411i7z3
97,相亲女孩摘下口罩后，男方损人不带脏字,16.7万,1164,163864,177617765,BV1Xz4y1979B
98,自制欧气检测器,14.6万,439,160120,280793434,BV1Kf4y117Kq
99,广东一司机肇事致人死亡 酒精检测时还露出微笑,16.1万,221,158513,200833184,BV1mK4y147ix
100,群  主  の  女  人,13.6万,161,157313,379365966,BV1wk4y167Rh
