视频bv号,up主,投币数,播放数,综合得分,视频标题,视频弹幕数,原创
BV1mi4y1G78L,腾讯,12321,1035502,814388,我就是那个吃了假辣椒酱的憨憨企鹅,10891,原创
BV1M5411Y76T,浮生蓑衣客,12720,488321,708767,一句话把骗子噎死,594,原创
BV1Ta4y1e7jX,凉风Kaze,28779,434413,686032,秃             ——阅片无数年度总结,5403,原创
BV1E5411Y7wC,摸鱼能手邓大头,15957,567719,633859,我爸是个逆反男孩了,2101,原创
BV1554y1z73A,华农兄弟,12625,740464,616402,华农兄弟：白天太热，晚上出来活动一下，抓点鱼,15649,原创
BV1vt4y197P4,大霓奈,2171,485168,615929,假如男生也有绿茶,1905,转载
BV1Bt4y197hZ,是桃子酱嘛,712,735189,595166,名场面预订了、笑死我了,545,转载
BV1AC4y1Y7NM,广州曙光口腔,543,707794,565054,神奇！医生将牙齿植入双目失明的老人眼中，老人重获光明！,554,原创
BV1c54y1z7LA,浩宇在路上,24900,443379,544517,妈妈知道我怕鬼，所以她走后从来没来过我梦里,573,原创
BV1bK4y1s7tt,关注看热点,162,694446,516626,热闹！老干妈上架1000瓶辣椒酱回应腾讯,822,转载
BV16D4y1Q7n6,蟑螂恶霸-G,1641,276140,506207,教大家一些没啥卵用但是看起来很帅的技能,140,转载
BV1Aa4y1e7cJ,记录生活的蛋黄派,14636,438174,497979,“读评论”我发现了海视频的方法,11965,原创
BV1Zk4y1z7AM,徐大sao,6214,570888,492537,酒店外卖点一圈，烤鸭面条杂酱粉，大sao差点失蒜，老婆开心坏了,5344,原创
BV1bf4y1173d,JaLEn半仙,666,595232,486511,今天刚刚学了一句撩人的话  怎么不怎么好,223,转载
BV1PK411H7gT,敬汉卿,25923,262839,459394,北漂三十天！（算个预告）,1794,原创
BV1o54y1i7Qe,美食作家王刚R,3834,405255,418255,厨师长教你：“泡椒腰花”的家常做法，味道巴适很下饭，先收藏了,2107,原创
BV1A54y1z7kN,旧真瞎哔哔,15445,333467,398311,我也想做一个伟大的人，可是老婆喊我回家洗尿布,1472,原创
BV1pD4y1Q7yi,洗剪吹六块钱,83,417264,369472,主人的任务,55,转载
BV1vp4y1U7z5,吾系哲学家,44,424521,366472,我网恋了一个女道士？,44,转载
BV1m54y1Q7eQ,冈部伦太郎·,11864,115431,362676,【醒醒】中华儿女该起床了,1399,原创
BV16A411i7Pn,钳子拯救没胃口,1529,351577,354922,当了几年海鲜奸商，我再也不敢给家里人吃龙虾尾了，猫腻太多,1008,原创
BV1ek4y1q7WM,中国BOY超级大猩猩,6918,228609,346698,不要笑挑战❌新故事王✔,1268,原创
BV1dk4y1z7c6,王尼玛,1579,328305,334601,腾讯对线老干妈，1000瓶辣椒酱你能秒我？！,374,原创
BV1PC4y1h75H,光速qaw,2667,228615,328434,节 奏 大 师,306,转载
BV19p4y1U7Hi,凉生kiki,408,329877,327351,如果是儿子，这将是另外一个故事。,308,转载
BV1mT4y1J7iG,幸运猎手,1978,244897,326437,武松打得过这玩意儿？,475,原创
BV1WK4y1s7zs,NWG新视野,44,365557,322569,"中国卖给捷克的动车交货,国外网友:谁能告诉政府我们也需要这个",227,原创
BV1ov411B7ZY,达达达布溜-,5958,268506,314675,不心动升级版！真·无人生还！有种就来试试看！,3679,原创
BV15V41167cN,清风子疯子,81,322632,310106,可 能 要 瘦 了,26,转载
BV1xD4y1Q7uu,食贫道,16026,176113,291037,北京三环里的苍蝇摊烤串，大号羊肉串肉筋现烤5元一串，新疆人吃了都说好！,3390,原创
BV1h5411Y7HP,观察者网,390,288093,278679,你的小可爱已上线？那些被熊孩子支配的恐惧,450,原创
BV14p4y1U7rk,文西与阿漆,3672,246543,278496,【黑娃兄弟】如果丧尸也种族歧视？美利坚成黑人天堂,465,原创
BV1Zv411B753,宇澄小哥,519,288086,273219,要不是被拍下来了，我可能永远都不知道发生了什么…,215,原创
BV1Z54y1i7oQ,趣测酱,5422,176803,269679,你哪方面的欲望最强？,3303,原创
BV1hf4y117Ts,可爱得要死嘞,11,291470,267770,【李佳琦】摘掉假发秒变张东升 李佳琦：“明天一起去爬山吗？”,98,转载
BV17k4y1z7mn,星晴dj,57,275999,267143,女朋友体验卡,20,转载
BV1N5411Y7gb,长得像美食博主的女人,1443,171561,262163,腾讯老干妈火腿炒面！真的比那些超多料的炒面好吃很多，搭配老干妈鸡腿,338,原创
BV1Nv411z7Ls,摆货小天才,2097,247432,255422,第一次去女朋友家，送点什么给未来岳父好呢？,355,原创
BV1yC4y187UJ,-不会吧阿sir,349,215686,249850,欺负别的狗被主人看到后,64,原创
BV13a4y1e77r,叫我大春就行了,1064,234129,249434,建 议 改 成：P 图 鬼 才,273,原创
BV1Y5411Y7rH,偏偏吃饱了,3307,213562,246616,我承认这个三不沾我有赌的成分,179,原创
BV16C4y187oM,糊涂的小老虎_,465,193545,240312,男生宿舍唯一的默契,153,转载
BV1wK411H7UD,大胡子魏,4805,207560,236574,花1300元买刮刮乐，就为证明买彩票浪费钱，结果一张就中600元！,699,原创
BV1GV411k7Zd,一点小生,4535,139206,235412,“你没穷过，你不懂”,510,原创
BV1Yv411B7uY,侧身离,19,246107,234480,凶到怂,101,转载
BV1NZ4y1p7VN,深海色带鱼,2499,192040,230458,在女朋友面前下单虚拟女友，你们看我还有机会吗？,4497,原创
BV1bC4y1877x,小潮院长,3059,183901,228101,"""杜海皇""之死",1746,原创
BV1PC4y1h7ni,ok1266,18,241089,227301,印度陆军加大了训练强度！太可怕了,225,转载
BV1dK411n72z,哔哩哔哩直播,2038,124546,226496,点进来听这首lex版烦恼歌，你的烦恼就会全部消失！【bilibili直播日报】,1989,原创
BV1Vi4y1V7Rt,亮亮也是酿酿,794,206654,225502,感受一下直男猫咪对你笨拙的爱…,167,原创
BV1P5411Y7HS,纳豆奶奶,4075,188357,221385,验证！日本食品和图片完全一致？妙龄女子试吃十几种竟然。。。,4224,原创
BV1t54y1z7nm,克里米亚野生动物园,19722,119221,220694,感谢所有朋友们的支持,963,原创
BV1zi4y1G7Q1,峰哥亡命天涯,1539,212011,220512,上流社会有钱人在吃什么？深圳人均2000元的餐厅，味道还不错,1235,原创
BV1Ap4y1S72m,腾讯QQ,425,215252,218087,太惨了！腾讯企鹅含泪吃老干妈辣椒酱,1350,原创
BV1Pv411z7CC,柚Fashion,40,219226,218020,闻者落泪！英国曼切斯特强奸犯落网 受害男性高达195名！,398,转载
BV1ot4y197Qd,腾讯新闻搬运工,38,227737,217599,女白领点活龙虾外卖忘记取 第二天上班看到发现龙虾已满地爬,28,转载
BV1Qf4y117jY,中二の小逸,42,229298,215808,当师傅切开的那一瞬间感觉自己赚了一个亿,6,转载
BV1Vf4y117AU,小林的柚子,6,222011,210658,我要进厂,21,转载
BV1PK411H7eu,入江闪闪灌水日记,7481,104253,204634,亲身经历最无耻直播平台，请混混砸门断电威胁女主播，现在倒闭了该喜大普奔吗？,1281,原创
BV1xg4y1v7dT,NJ1987,8,213429,203423,3名泳装女子海滩嬉戏后到冲洗间换衣 正换到一半时集体崩溃,42,转载
BV1EK4y1s7ZQ,巫托邦,10131,129492,202800,跟冰淇凌私奔去了,768,原创
BV1av411B7Ko,大胃王密子君,2605,180151,200821,大密｜网友推荐2米鹅肠探店！自养蔬菜现剪现吃太新鲜 | 成都探店吃播,2436,原创
BV1Kz411v7gA,phasw,143,172569,200322,哈哈哈哈哈当鬼屋放错音乐,52,转载
BV1AD4y1S7Gw,姚姚不是P30,1143,181681,197519,当我用李云龙的语录跟爸妈说话时！事实证明.. 近战不适合用狙....,210,原创
BV1dJ411J7WP,不可多得先生L,420,128492,194598,如果播音小姐姐被处罚了 全赖你们！,83,转载
BV1QA411i7kW,奶酪和neo,377,189793,193083,亲眼见证女朋友被11岁小萝莉完虐，我差点笑出了声...,857,原创
BV1Yp4y1U7AP,老高VS小高,4664,127325,191973,父子好奇十只复读鸭能不能同时说出“你过来鸭” 试完之后，他俩崩溃了！,731,原创
BV1TZ4y1p7Qh,稻草放毒,732,187389,188436,我的年中总结,185,原创
BV1dZ4y1H7tn,安琪大总攻,1490,159939,185017,腾讯被骗后去报警【美人鱼名场面】逗鹅冤！手里的老干妈辣椒酱突然不香了！,463,原创
BV1gZ4y1p7sf,瑞克丶张,82,166150,182183,当黑人警察下班时……,9,转载
BV1xD4y1Q7e2,洗洗涮涮修修补补,48,180381,181162,强迫症患者表示极度舒适 | 快扶我起来！我还要再看一遍,429,转载
BV1j54y1z7L3,冰淇淋不冰c,1256,156068,180852,川建国首次回应中国卧底传闻【新闻胡说间】（假的假的假的）,256,原创
BV1yf4y1y7nY,我在旺角杀左人,1324,142502,178409,特朗普首次回应B站恶搞视频,464,原创
BV135411Y7kc,胥渡吧,3955,127973,177759,胥渡吧：明清帝王对话（3）：顺治拜崇祯，雍正怼嘉靖,1148,原创
BV1Pg4y1q7Tr,中山牙齿矫正冯碧妙,11,179590,176765,肾结石清理的动画演示，看得好疼啊！多喝水多喝水,31,转载
BV1Hf4y117dw,农乡大爷酱,11312,106859,176129,抱歉 爷爷身体不好，先不更新了,2079,原创
BV1vv411B7JV,烂活传说,15,181480,175826,家人们一手养起来的大富豪,6,转载
BV1Lp4y1D73W,睡不醒的部长,169,152941,175484,才   一   万   ？,45,转载
BV1V54y1z7di,冬冬和37,342,169488,175397,当着女朋友的面看小姐姐！暴风雨前的宁静,71,原创
BV1Ci4y1G7XP,元气八眉菌,3161,60244,174803,完美复刻！日本东京No.1 每天限量32条的芝士蛋糕 | 不是世界上最好，但可能是人生中吃过最好吃的～,251,原创
BV1Ft4y1972e,阿狸是个大收藏家,341,133918,174418,建议保送清华,127,转载
BV1Wt4y197wc,outsider王生余,53,168289,172804,和网友奔现，他把我骂惨了……,445,原创
BV1Z54y1i7vT,he蚂蚁,106,156915,172730,同样是四驱，怎么跑起来差别这么大的,37,转载
BV1Aa4y1e7aR,女胖胖,1750,153907,172509,"买了20多种黑色的食物，尝试真正的""黑暗料理""，黑色口香糖差点吃中风！",3338,原创
BV1u54y1z7oc,吃货请闭眼,1796,155848,169450,北京最贵的吃肉圣地，顿顿1000+，吃起来太过瘾！,238,原创
BV15A411e7b3,托马斯家的,2943,145014,167030,震惊！小伙竟然给女友买了这种衣服！！,1789,原创
BV1dz4y197zd,绝对不再熬夜,3148,89462,166948,《樱  桃  老  丸  子》,180,原创
BV1QC4y187HM,大蟀蝈,4330,122577,164642,高考神药，祝你金榜题名,1198,原创
BV1cz411v7PA,盖里老哥,3001,136157,163810,翻车现场！情侣玩测谎仪差点双双分手！疯了 都疯了,1751,原创
BV18T4y1J7zr,柠檬没有橘子酸_,126,141660,163699,打个车儿子没了,20,转载
BV1Vz4y1X77R,消失的鳗鱼,1441,133784,162833,精神病院里长什么样？抑郁症患者在广州住院17天的一些生活小片段 /mect无抽搐电休克 / 广东省惠福医院 / 出院快乐！,1292,原创
BV1Xz411e7dS,vivi可爱多,6761,78967,161855,刚毕业我是如何乘风破浪的？！不好意思，坑太多根本没浪起来！,1697,原创
BV1Yg4y1v7a8,声鱼片儿,14259,58284,161707,千万不要跟声优斗表情包，否则你将毫无胜算【35】,1532,原创
BV1KZ4y1u7T4,17岁反派里的持枪Boy,2,165109,159688,来个专家解释一下，水为什么可以燃烧？,25,转载
BV1N5411Y7Sy,黄一刀有毒,2207,119320,159542,我保证这不是恐怖漫画 （胆小勿入）,1237,原创
BV1EJ411n7Dg,火线妹,287,149564,159457,本 尊 出 现,320,原创
BV15z411v7bW,手工阿飞,5633,115400,158856,阿飞通宵三晚，终于拍到了罕见的帝王伟蜓羽化，并封存了个空壳做纪念,389,原创
BV1Df4y1174h,老番茄,3633,110383,158123,口技大师！,1427,原创
BV1KK411H7SV,广东共青团,942,136124,157895,“这是我爸”“爸！”,457,转载
BV1o7411E71J,草莓味鸡胸肉,126,55315,157719,【Pamela Reif】魔鬼帕梅拉10分钟初学者腹部训练，新手姐妹也能跟得上啦！,373,转载
